commit	val_bpb	memory_gb	status	description
a54f6c7	0.988857	2.3	keep	reduce model size: depth=4, experts=4, mhc_expansion=2
01cb493	0.905596	2.3	keep	learned stream projection weights
42f8afc	1.202811	2.5	discard	increase mhc_expansion to 4
3f4f231	0.000000	0.0	discard	increase depth to 8 with learned projection (incomplete)
17d3d3a	2.038899	2.3	discard	replace MuonAdamW with AdamW for all parameters
a664647	0.886884	2.3	keep	increase MATRIX_LR to 0.08 with MuonAdamW
b9c0baa	0.937675	2.3	discard	change AdamW betas to (0.9, 0.999)
0a393db	0.885009	2.3	keep	increase Muon momentum to 0.99
bd3e736	0.884200	2.3	keep	increase Muon ns_steps to 10
e3ebce0	0.885242	2.3	discard	increase Muon beta2 to 0.99
053fb55	0.884437	2.3	discard	increase WEIGHT_DECAY to 0.3
91d29fd	1.073391	2.3	discard	add 10% warmup
8f94c4a	0.928131	2.3	discard	extend warmdown to 80%
a74ab8b	0.000000	0.0	crash	increase mHC AdamW LR to scalar_lr*0.2
aacca4d	0.000000	0.0	discard	increase to 32 experts, 2 shared (timeout)
8af1092	1.235903	4.5	keep	50min training with fineweb-edu dataset, 4 experts baseline
fec3d57	1.323132	7.6	keep	50min training with depth=6, 4 experts
5a9fd42	1.419943	11.7	keep	50min training with depth=8, batch_size=8, activation checkpointing
e73e2df	1.327411	7.5	keep	baseline with vocab=16384, 60min training
49a13bf	1.381647	9.5	discard	try 8 experts (worse than 4)
HEAD	1.376761	8.6	discard	try 6 experts (worse than 4)